filename,type,text
regina_v_wing_chong.txt,case,"CREASE, J. 1885. REGINA v. WING CHONG. 

14th & 15th July, Certiorari—“Chinese Regulation Act, 1884,” s. 5—Constitutionality—B.N.A. Act, 1867, ss. 91, 92—“Aliens”—“Trade and Commerce”—Taxation. 
On the return to a writ of certiorari. Held, that the “Chinese Regulation Act, 1884,” is ultra vires of the Provincial Legislature, on the following grounds: 
1. It is an interference with the rights of Aliens. 
2. It is an interference with Trade and Commerce. 
3. It is an infraction of the existing treaties between the Imperial Government and China. 
4. It imposes unequal taxation. 

14th & 15th July—On the return of a writ of certiorari directed to Edwin Johnson, Esquire, Police Magistrate for the City of Victoria, to return into this Court a certain conviction made by him under which one Wing Chong was fined $20 for not having in his possession a license issued under the “Chinese Regulation Act, 1884.”

The Attorney-General in support of the conviction said there were five points raised on the rule for the certiorari against the validity of the $10 tax.—1st. That it interfered with the Dominion powers under the B. N. A. Act, aliens, and naturalization; 2nd. Trade and commerce; 3rd. Treaty obligations; 4th. That the tax was unequal, and 5th. It was indirect taxation. As to the first point aliens were as much subject to taxation as citizens. Protection and taxation were reciprocal (Cooley on Taxation, p. 14). The law did not deal with the conditions under which aliens might acquire rights or become subjects of Her Majesty. Secondly—Trade and commerce were not interfered with. The object of the Act was two-fold, the police and sanitary regulation of a numerous foreign element, and the raising of revenue necessary to meet that regulation (Hodge v. The Queen, L. R. 9, App. Cas. 117). If incidentally trade and commerce were touched, the provincial power of direct taxation was not impaired (Citizens Insurance Co. v. Parsons, L. R. 7 App. Cas. 108). The preamble and scope of the Act showed its objects were purely matters of the police and raising of revenue to meet the necessary expenditure, and within “Direct Taxation.” Thirdly—The treaty obligations of England did not affect the question. The last communication from the Secretary of State for the Colonies to the Governor-General, dated 16th May, 1884, stated, in effect, that the Colonies with responsible government could pass restrictive laws irrespective of treaties (B. C. Sessional Papers, 1885, p. 464), and instanced the legislation of the Australian Colonies and of the Dominion. Fourthly—As to unequal taxation, the power of the Province within its jurisdiction was supreme and as plenary as that of the Imperial Parliament (R. v. Burah, L.R. 3 App. Cas. 904; R. v. Hodge, L. R. 9, App. Cas. 117; and Powell v. Apollo Candle Co., L.R. 10 App. Cas., p. 290; and *In re Goodhue*, 19 Gr. 366); *Cooley* on Taxation, pp. 3, 82, 126-128, and *Cooley's Constitutional Limitations* (5th Ed.) 626-7; *Sedgwick* on Stat. (2nd Ed.), p. 501; *Potter's Dwarris* 418, 421, 425; *Dow v. Black*, L. R. 6 P. C. 272, were cited as showing the power of taxation, unless abridged by the written constitution, might be exercised so as to discriminate. The Supreme Court of Canada, in the case of *Jonas v. Gilbert*, 5 S. C. R., 356, had practically decided the same point. Fifthly—Whether called a licence or not, the imposition was a direct poll tax, and as such came within the power of the Province to raise money by direct taxation for Provincial purposes. *Cooley* on Taxation, 386; *Wharton's Law Lexicon*; *Reed v. Mousseau*, 8 S. C. R., 408. It was not a license to carry on business, or a method whereby indirectly money was raised from the consumer, as, for instance, customs or stamp laws.

*Richards*, Q. C., for Wing Chong—The object of the Act was not for police purposes or to raise revenue. Its object, though not apparent on the face of the Act, was to prevent Chinese coming into the Province and drive out those who had already come. He reviewed the legislation against Chinese since confederation, contending it was levelled against a particular race of aliens and, therefore, beyond provincial control, per *Gwynne*, J., in *Citizens Insurance Co. v. Parsons*, 4 S. C. R., at p. 346. The law was a direct interference with trade and commerce (*R. v. Severn*, 2 Can. S. C. R., 70). If its object were successful and Chinese driven from the country, the customs dues received from the Chinese would be lost and the benefits of trade relations enjoyed by the merchants would be destroyed. Counsel cited statistics from the Chinese Commission showing the extreme importance, from a fiscal and commercial point of view, of the large number of Chinese in the Province. The Dominion under the B. N. A. Act had alone the right of performing in Canada the obligations of Canada as part of the British Empire in respect of treaties, and although Canada might pass laws prohibiting immigration, or having that tendency, the Province could not do so, nor could it pass laws in derogation of treaties. He cited the British treaty (25th August, 1842, from *Hertslet*, Vol. 6, and Lord *Elgin's* treaty, 1860), comparing it with the *Burlingame* treaty of the United States, and quoted California decisions (*Lin Sing v. Washburn*, 20 Cal. 334), and the decision of *Gray*, J., in *Tai Sing v. Maguire*, deciding that similar legislation was held void as contravening the treaty and the sovereign power to regulate trade and commerce with foreign countries. 

*Drake*, Q. C., on the same side, argued that the imposition of the $10 tax was invalid because of inequality. Inherent in and incidental to the taxing power was the characteristic of equality. *Cooley* stated that irrespective of constitutional limitation a particular class of citizens could not be burdened for the advantage of others—*Cooley's Constitutional Limitations*, p. 635. This was a principle underlying the power to tax and governing that right even though the CREASE, J. 1885. REGINA v. WING CHONG. written constitution made no mention of it—Cooley on Taxation, p. 18, and City of Lexington v. McQuillan, 35 Am. Dec. 159. The imposition was in derogation of treaty rights with which Canada alone had the power to deal. The Australian legislation did not help the contention of the Attorney-General. The Australian Colonies were autonomous, and occupied the same position as that of Canada. The Provinces were not autonomous. He did not contend that the whole of the Act was invalid. Much of it was within the scope of the Province, notably the provisions affecting the size of dwellings, the forbidding the use of opium, and the desecration of grave-yards. He insisted that imposing excessive taxation on one class of citizens was unconstitutional. The remarks of Chief Justice Ritchie, in the case of Jonas v. Gilbert before the Supreme Court of Canada, were obiter dicta, as the decision was upon another point, and intimated, but did not decide the right of the Provinces to discriminate, nor in what things and to what extent discrimination in taxation was legitimate. Lastly, the Act was for indirect taxation, which was a power given only to the Dominion Parliament. It was a license fee, the power to impose which had, in Severn v. The Queen, been decided against the Provinces on the score of such legislation being against trade and commerce. 

The Attorney-General in reply—The ten dollar impost was a tax whether designated by the name of a licence or otherwise. The distinction between direct and indirect taxation was well drawn in the case of Reed v. Mousseau before the Supreme Court of Canada, in which Mr. Justice Strong mentioned the Privy Council had decided the Provincial legislatures had exclusive power to impose direct taxation, and that it did not follow they might not have power even to impose indirect taxation. The tax did not sanction the carrying on of any business out of the product of which the consumer would, indirectly, contribute towards payment of the tax. Then as to inequality, the one dictum of Cooley was but an expression of opinion that political wisdom required uniform taxation; for the same author cited numerous authorities, including that of the Supreme Court of the United States establishing the right to discriminate unless fettered by the express language of the Constitution. Todd on Parliamentary Government in the Colonies, supported the view that the Provinces within their jurisdiction were as omnipotent as the Imperial Parliament. The California cases (see The People v. Naglee, 1 Cal. 232) decided a differential tax might be imposed on foreign miners; and though a later case (Lin Sing v. Washburn, 20 Cal. 334) had decided a special tax could not be imposed on Chinese, a most celebrated Judge, Mr. Justice Field (since elevated to the Federal bench), dissented, and had pointed out that according to federal decisions the State might impose special taxation on alien residents, provided the impost was not levied against foreigners landing in the country. The tax was not to exclude the Chinese — another statute with that object had been disallowed. It was imposed to meet the extraordinary expenses incident to enforcing the police and sanitary regulations prescribed by the Act. The question of treaties had nothing to do with the subject, for to responsible governments the Imperial Authorities conceded the right to pass laws within their jurisdiction. So the Canadian Parliament to-day was passing a restriction Act. Opponents to the Act might as well contend the exclusion of the Chinese from the franchise, and barring them from acquiring lands, was illegal. As to autonomy, neither the Australian Colonies nor the Dominion were absolutely possessed, but the Province equally with Australia and the Dominion were autonomous within the bounds of their respective jurisdictions. 

21st August, 1885—CREASE, J.— In order to deal satisfactorily with the questions raised by this appeal, it is necessary to see what is the scope and purport of the Act. It is called ""An Act to regulate the Chinese population of British Columbia."" It starts with a recital, in itself a petio principii—not apparently the result of any public enquiry—which charges them with being not law-abiding, dissimilar in habits and occupation to the whites—useless in emergencies, habitual desecrators of grave-yards, unsuited to our laws, and of habits subversive of the community. From that premises concluding that special laws are required for their government, it proceeds to enact:— 

1. The title.

2. Defines Chinese to mean ""any native of the Chinese empire or ""its dependencies not born of British parents, and shall include any ""person of the Chinese race."" 

Section 3—with which we are immediately concerned—says:—""From and after the passage of this Act there shall be payable and ""paid by every Chinese in British Columbia, above the age of fourteen years, unto and for the use of Her Majesty, her heirs and successors, the sum of ten dollars, and thereafter on the 1st day of June in ""each and every year there shall be likewise payable and paid by such ""Chinese person a further sum of ten dollars."" 

Sec. 4 provides for the appointment and payment of special collectors, ""to be called Chinese collectors, to collect and receive such ""payments from Chinese; and such collector or collectors, immediately upon such payment, shall issue and deliver to the person paying ""the same a licence in the form contained in the schedule hereto."" 

By Sec. 5 ""Any Chinese who shall be found within the Province ""not having in his possession a licence issued under the provisions of ""this Act, lawfully issued to him, shall, on conviction thereof, forfeit ""and pay a sum not exceeding forty dollars."" 

By Sec. 6 ""Any collector or Government servant wilfully disobeying ""any of the provisions of this Act shall forfeit and pay a sum not ""exceeding one hundred dollars."" 

By Sec. 7 ""Every collector shall collect the tax from each Chinese, ""and shall as soon afterwards as may be pay over the amount to the ""officer in charge of the Treasury, or to such other person as the ""Lieutenant-Governor in Council may from time to time direct.""  

By Sec. 8 “Every employer of Chinese shall furnish to the collector “when requested by him so to do, from time to time, a list of all “Chinese in his employ, or indirectly employed by him; but no such “statement shall bind the collector, nor shall excuse him from “making due enquiry to ascertain its correctness.” 

Section 9. “In case any employer of Chinese fails to deliver to the “collector the list mentioned in the preceding section, when required “so to do, or knowingly states anything falsely therein, such “employer shall, on complaint of the collector and upon conviction “before a Justice of the Peace having jurisdiction within the “district wherein such employer carries on his business, forfeit “and pay a fine not exceeding one hundred dollars for every Chinese “in his employ, to be recovered by distress of the goods and chattels “of such employer failing to pay the same, or in lieu thereof shall be “liable to imprisonment for a period not less than one month and not “exceeding two calendar months.”

Section 10 gives the collector power to “levy the amount of the license from any Chinese not being in lawful possession of a license, “with costs, by distress of his goods and chattels, or of any goods and “chattels which may be in the possession of the delinquent, or which “may be upon or in any premises (whether the goods of the delin- “quent or not) for the time being in the possession or occupation of “such delinquent Chinese,” and declares that “for the purposes of this “section premises shall be deemed to be in the possession or occupa- “tion of any Chinese when it can be shown to the satisfaction of the “tribunal having cognizance of the matter (a) that such Chinese “habitually frequents such premises with the assent of the owner ; “(b) that he is the owner or one of the owners of the premises, or has “control, either alone or jointly, with another or others, of such pre- “mises or some part thereof; (c) that he has passed the night or slept “upon such premises at any time within a week of the levy, it shall “be sufficient authority for the collector to levy as aforesaid on the “non-production of the license. Proof of the lawful possession of “such receipt shall lie on the person whose goods are restrained.” 

By section 11 every license must be demanded by the employer and retained during the Chinaman’s service. 

By section 12 tax collectors are not to allow Chinese to pass unless a license is produced. 

Section 13 imposes a penalty of $50 on any person guilty of employing any Chinese not having a license. 

Sec. 14 Fee for free miner’s certificate to a Chinese to be $15, instead of the white man's $5. 

Sec. 15. Penalty not exceeding $30 for every Chinaman mining without a license. 

Section 16 amends the License Ordinance of 1867, whereby the pursuit of various callings is sanctioned by the ominous words, “but no license shall be issued to any Chinese.” 

Sections 17 and 18 prevent the exhumation of dead bodies without permission, and prohibit the use of opium except for medical purposes. 

Section 19 provides for the recovery of any pecuniary penalty thereunder in a summary manner before a J. P., and in default of immediate payment sanctions a distress, and failing that, imprisonment for not exceeding three months. 

Section 20 (amended by Act of 1885) declares that ""convictions are not to be quashed for want of form."" 

Section 21. “Any Chinese who shall lend his license or free miner's ""certificate to another Chinese, and any Chinese who shall utter or ""pass off upon any collector or other person any license or free miner's ""certificate other than his own, with intent himself to avoid payment"" of the license fee payable under this Act (and the onus of proving “that such was not his intent shall rest upon the person charged), shall ""forfeit and pay a penalty of not less than twenty dollars nor more ""than one hundred dollars."" 

Section 22 enacts that the tribunal applied to may decide ""on its own view and judgment"" whether any person is a Chinese or 14 years old. 

Sections 23, 24 and 25 contain sanitary provisions affecting buildings let to Chinese. 

Section 26 provides a means whereby persons imprisoned for an infraction of the Act may be put to hard labour by an Order in Council, and the same executive authority is empowered to make rules and regulations for carrying out the Act. 

Section 27 places in the hand of the local executive the construction from time to time of further rules and regulations to enforce the Act, and a fitting summary to such a premiss in section 28 reverses all the old law of England and one of the most cherished and priceless safeguards of the freedom from oppression won for us by our forefathers—that no one shall be deemed guilty until he has been proved so—throws on the defendant, white or yellow, the burden of proving that he is exempt from the operation of its arbitrary provisions—and in a tax Act which is in restraint of personal liberty, and opposed to the common law rights of the citizen—for if applicable to aliens it is a fortiori to the temporary inhabitants of the Province—abrogates the hitherto invariable rule in criminal matters and makes it unnecessary in any information, summons or conviction to “state or negotiate any “exception in or exemption under this Act, or in contemplation of “law.” Taught by experience of former efforts in the same direction, section 29 gives one year’s notice of the coming into operation of the Act—a time which has now expired. And section 30 terms it merely “The Chinese Regulation Act, 1884.” 

The only schedule is the form of license, which runs as follows:—

The question now raised on the construction of this Act affects not only British Columbia, but, as she occupies the only Pacific seaboard of the Dominion, indirectly more or less the very many other Provinces under the flag of confederation. 
Taking for convenience the five points of objection to the conviction in the order in which they are made— 
1. That it interfered with the Dominion powers under the B. N. A. Act over aliens and naturalization. 
2. Trade and commerce. 
3. Treaty obligations. 
4. That the tax was unequal. 
5. That it was indirect taxation and therefore illegal, and should be quashed. 

On the first point, I would observe that it is now well settled law that British Columbia, as a part of the Dominion, possesses all, but possesses only, the powers which are strictly defined by the B. N. A. Act of 1867, which is, indeed, the constitution of Canada.

Neither she nor any other of the Provinces possess any other powers of legislation than are conferred by that Act. If British Columbia, or any other Province, in its legislation, goes beyond that Act and in excess of its provisions, that moment, and to the extent of such transgression, it ceases to be law. Therefore, in dealing with this question, our constitutional Act must be kept in view throughout, as the measure by which we must continually gauge the legality or illegality of the provisions of the local statute under consideration. 

The Act of Federation was passed in order to be an irrefragable, permanent standard by which to preserve and regulate all the relative rights of the Provinces, as among themselves and as regards the Dominion. 

The exclusive powers of that Act given to the Dominion over particular subjects are contained in the 91st section. The exclusive powers of the Province are particularized in section 92. It is natural that in the working out of such a constitution in a new and growing country, questions should be continually cropping up, and call upon the Courts to define gradually and with greater exactness, as time progresses and population expands, the relative powers given by the Act to the Dominion and Provinces respectively. Sub-section 2 of section 91 gives to the Dominion Parliament exclusively the regulation of “trade and commerce,” and by sub-section 25 that of “naturalization and aliens,” and everything relating to those subjects as affecting the whole Dominion is within the Dominion powers, and no local Legislature can make any statute interfering with either of those subjects. If it does, so far as such interference extends it is illegal and void, and when brought before the Court it is the duty of that tribunal so to adjudge it.

And the converse of this is true when applied to Dominion legislation as affecting the subjects exclusively given by the constitution to the Province. 

Now, applying this test to the statute before us, let us see whether and how far its provisions affect, as is alleged, aliens, or trade, or commerce. 

The aliens in this case being Chinese, the first enquiry must be, what is the object of the Act? On applying to the preamble, we find that it looks like a bill of indictment as against a race not suited to live among a civilized nation, and certainly does not prepare one for legislation which would encourage or tolerate their settlement in the country. Indeed, the first lines of the preamble sound an alarm at the multitude of people coming in, who are of the repulsive habits described in the last part of the preamble, and prepares one for measures which should have a tendency to abate that alarm by deterrent influences and enactments which should have the effect of materially lessening the number of such undesirable visitors. The provisions of the Act I have given somewhat in extenso bear out that view, and the concurrent and previous local legislation bear out the same impression, for on the same day as this Act was passed, another Act was passed, the very object of which was plainly stated to be ""to prevent the immigration"" of Chinese."" 

That Act was disallowed. It interfered with aliens as well as trade and commerce, which cannot subsist among nations without personal intercourse, which such an Act (as far as China was concerned) would have a tendency to prohibit. 

Another statute (of 1878), ""An Act to provide for the better collection of taxes from Chinese,"" which contained several of the stringent provisions which I have described in this Act, such as a special tax specially recoverable by summary and unusual remedies from the Chinese alone, in British Columbia, and enforced by fine and imprisonment and other penal clauses, came before this Court, and in a most conscientious and exhaustive judgment of Mr. Justice Gray, of 23rd September, 1878, in the case of Tai Sing v. Maguire, was declared unconstitutional and ultra vires the Local Legislature, as interfering with aliens and trade and commerce—matters reserved exclusively under the 81st section of the B. N. A. Act to the Dominion. That decision was never appealed from, and was at once acted on by the government as conclusive. 

The position and legislative powers of British Columbia have been in no respect altered in its relations to the legislative powers of the Dominion on the same subjects since that time, though Russell v. The Queen (7 App. Cas. 829) and Hodge v. The Queen (9 App. Cas. 117) have more fully defined the extent of the powers of the Provincial Legislatures than has hitherto been done; and in the latter case especially. That decision, however, was not before Mr. Gray when he rendered the judgment in Tai Sing v. Maguire. Until reversed or varied, the decision in the Hodge case is law here, and binding on this Court. 

Their lordships say (page 132), with reference to the objection of the appellants there (delegatus non potest delegare):—
""It appears to their lordships, however, that the objection thus raised by the appellants is founded on an entire misconception of the true character and position of the Provincial Legislatures. They are in no sense delegates of or acting under any mandate from the Imperial Parliament. When the British North America Act enacted that there should be a Legislature for Ontario"" (for this case we may for ""Ontario"" read ""British Columbia""), ""and that its Legislative Assembly should have exclusive authority to make laws for the Province and for provincial purposes in relation to the matters enumerated in section 92, it conferred powers not in any sense to be exercised by delegation from or as agents of the Imperial Parliament, but authority as plenary and as ample within the limits prescribed by section 92 as the Imperial Parliament in the plenitude of its power possessed and could bestow. Within these limits of subjects and area the Local Legislature is supreme."" 

[So far this decision confirms the words of Lord Selborne in R. v. Burah; what follows goes beyond it.] ""And has the same authority as the Imperial Parliament or the Parliament of the Dominion would have had under like circumstances to confide to a municipal institution or body of its own creation authority to make by-laws or resolutions as to subjects specified in the enactment, and with the object of carrying the enactment into operation and effect."" 

That decision, although in some respects an obiter dictum, as regards this case, makes it clear that within the limits of subjects and the area prescribed by the B. N. A. Act, by section 92, the Legislature of British Columbia is supreme. The basis, then, of our enquiry must be: Is this Chinese Regulation Act of 1884—rather the parts of it objected to—within the limit of subjects and area of section 92, or does it exceed those limits in which it is supreme, and interfere with aliens, trade and commerce in such a manner as to encroach on section 91 or any of its sub-sections? If so, so far as it does so, it is unconstitutional and ultra vires, and therefore void. Now it does not follow because a local Act touches on these three subjects it therefore interferes with them so as to render it unconstitutional. 

Aliens may be taxed, may be subjected to the same rules and municipal and other by-laws as other inhabitants of British Columbia, and such discrimination in so doing as are allowed in local legislatures between and among different persons and occupations among the whites are quite as applicable to them. These are the only discriminations which the law allows, and these are the permissible discriminations spoken of by Cooley in the portions cited before the Court. During the argument the case of *Lin Sing v. Washburn*, 20 California Reports, 534, was quoted as bearing on this case. There, an Act of the California Legislature passed an Act imposing a capitation tax “on ‘each person, male and female, of the Mongolian race of the age of 18 years and upwards residing in the State,’ accompanying a license almost a *fac simile* of our own, and enforced in much the same way as in the case before us, that, after long and elaborate argument in which the Attorney-General appeared for the State, was determined to be unconstitutional, as it was an interference with trade and commerce, which could be regulated alone by the general government. It was in vain advanced that at least the State had concurrent jurisdiction in matters of taxation relative to its own internal affairs, of which this was one (the same proposition as was advanced by the Attorney-General in this case) in which it had a supreme and autonomous right to legislate. And the grounds of this decision were that the federal constitution had vested in the general government the power to regulate commerce in all its branches (as with us in the Dominion); and this power extends to every species of commercial intercourse, and may be exercised upon persons as well as property (Mr. Justice Field, whose arguments have been reproduced by the Attorney-General before me in this case, dissenting). 

That commerce cannot be carried on without the agency of persons, and the tax, the effect of which is to diminish personal intercourse, is a tax on commerce. If the power to impose such a tax is acknowledged, it being a sovereign power, no limitation can be affixed to its exercise, and it may be so used as not only to diminish but destroy commerce. 

The power asserted in the Act in question (the California Act) is the right of the State to prescribe the terms upon which the Chinese shall be permitted to reside in it, and be so used as to cut off all intercourse between them and the people of the State, and defeat the commercial policy of the nation. 

That the Act could not be maintained as a police regulation; that a branch of the police power had been surrendered to the Federal Government as a part of the power to regulate commerce, and its exercise by a State was incompatible with the authority of the Government. 

That the Chinese might be taxed as other residents, but could not be set apart as special objects of the taxation, and be compelled to contribute to the revenue of the State in the character of foreigners. 

The reports of the higher California courts are of great authority for us on all Chinese questions, for there have been efforts for years past to restrict Chinese immigration in California, and the matter has been constantly before the superior courts there, and the judges there (if we may take the reports as correct) are more than ordinarily skilled in laying down the law correctly in constitutional points of that nature. Indeed, there is no other country which has such experience generally in constitutional law as applicable to a federation of states. 

Of course, in all the observations I make I recognize the now well-known distinction between the relations of a State of the Union to the Federal Government, and our relation as a Province to the Dominion. Still both Federal Governments have reserved to themselves the regulation of trade and commerce and naturalization and aliens; so the analogy is so close as to become almost a direct authority. 

In the *Lin Sin* judgment, p. 579, the learned judge says of the power of taxing foreigners, as in the present *qua* foreigners: “If the power exist it may be exercised upon all foreigners residing in the State, and may be so exercised as to bar the door of foreign commerce as effectually as the Government could do by issuing its man-“date and closing its ports."" 

And again ""to determine whether there is a conflict or not, i.e., of jurisdictions, the power must be considered with reference to its consequences, for its effect when carried out is the only criterion by which a judgment can be formed.""

In another place he says:—""It would be an empty sound to say that the several States cannot pass any law to prevent foreigners from coming here if they may pass laws which will compel such foreigners to depart as soon as they arrive."" 

And again, ""A tax imposed by the law on these persons for the mere right to reside here, is an appropriate and effective means to discourage the immigration of the Chinese into the State.""

During the argument on the case before me, the Attorney-General claims that this was direct taxation, and a direct tax within the Province, to raise revenue for Provincial purposes, and, therefore *intra vires*; but the question is not one of name but of fact. Does it interfere with trade or commerce? Can it be legally imposed on foreigners as foreigners, for even a legal tax in other respects becomes illegal when it goes beyond its proper limits, and interferes with powers exclusively given to the Dominion for the benefit of all? 

In another California case, *In re Tiburcio Parrott*, it is laid down that if the apparent object of a statute is under a pretense of the exercise of constitutional powers to drive Chinese away, the end sought to be obtained being unlawful, the statute is void. 

In *Russell v. Reg.* it is decided that the true nature and character of legislation must be determined in order to ascertain its legality. 

In *Citizens Insurance Co. v. Parsons*, we have to look at the legislation for the same purpose. 

If the legislation here be to drive people from the country, have the local legislature the power? Legislation as to aliens is reserved to the Dominion. And as to trade and commerce, if the Chinese be driven out an annual loss to the revenue, it appears by the tables in the Chinese Commission Report, of $110,000 will take place; and more than $1,500,000 of property and business be lost to us, besides an injury to trade to an incalculable extent. The amount of business transacted by Chinamen in British Columbia, as revealed by the tables in that Chinese Report, is something which a casual observer would have no idea of. 

The treaties between Great Britain and China, which bind us, have been quoted. The treaty of 25th August, 1842, *Hertslet*, Vol. 6, ratified 26th June, 1843, p. 221, and Lord Elgin's treaty of October, 1860, authenticated copies of which were produced in Court, secure to Chinese coming into British dominions the same ""full security for persons and property as subjects of Her Majesty."" 

*Vattell*, cap. 8, referring to our obligations to foreigners, observes:— ""As soon as the lord of the territory admits strangers into it he engages ""to protect them as his own subjects, and to afford them perfect security as far as depends on him.""

*Reg. v. Severn* and *Reg. v. Russell* are important authorities in guiding our enquiry as to the nature and effect of local legislation in determining whether and how far the Act under review exceeds the limits within which the local legislature is supreme. And as to the equality of taxation, besides *Cooley*, who has been quoted freely on both sides, in *Kent's Commentaries* (8th Ed.), 2nd Vol., 388, it is insisted—""That every person is entitled to be protected in the enjoyment of his property, not only from invasions of it by individuals, but from all unequal and undue assessments on the part of the Government. It is not sufficient that no tax or imposition can be imposed upon the citizens, but by their representatives in the legislature the citizens are entitled to require that the legislature itself shall cause all public taxation to be fair and equal in proportion to the value of 'property"" (and that is what *Cooley* means by apportionment of taxation), ""so that no class of individuals, and no species of property shall be unduly assessed."" The treaties I have quoted between Great Britain and China, binding on the Dominion and on us in British Columbia, secure to the Chinese, just as the treaties between Great Britain and other foreign countries secure to other foreigners, the same rights in regard to the equality of taxation which I have described as being enjoyed by citizens of this country. 

These treaties have the force of international law, and are continued most strongly against the party for whose benefit they are introduced. 

In the case of the Chinese treaties, they were forced at the point of the bayonet on China, to obtain a right for us to enter China, and in return for a similar permission to us, full permission was given for the Chinese to trade and reside in British dominions everywhere. 

In the treaties of 1858 and 1860, made at the solicitation of Great Britain, the Emperor of China was induced to give permission to his subjects to go and trade and reside ""in British Colonies,"" and to enter into ""engagements with British subjects for that purpose."" 

These obligations are binding here and in other parts of the Dominion under section 132 of the British North America Act, and no Province, or the Dominion itself, can lawfully pass laws interfering with that right without a previous revision of the treaties by the high contracting parties to them for that purpose. Treaties with foreign nations are above all ordinary municipal law, for obvious international reasons, for without such a provision there can be no permanent security, which is the life of all commercial intercourse. The same provisions that apply to Chinese may be made to apply also to Americans, Frenchmen, Germans, or any other foreigners. Such treaties are the especial care of the Dominion, and where local legislation clashes with that especial province of the Dominion, the legislation of the Province must give way, as laid down in Leprohon v. the City of Ottawa, 40 Q.B., Ont., 478; Reg. v. Chandler, Hannay's New Brunswick Reports, 548; Dow v. Black, L.R. 6 P.C. 272; L'Union St. Jacques v. Belisle, L.R. 6 P.C. 31, and numerous other Canadian authorities, besides the British North America Act itself. Now applying the principles and tests I have described to the Act before us, what do we find? The Act is found associated with another Act now disallowed, the express object of which is to prevent the Chinese altogether from coming to this country, and the principle ""noscitur a sociis"" is kept up by the preamble of the present Act, which describes the Chinese in terms which, I venture to think, have never before in any other country found a place in an Act of Parliament. 

In the definition of the persons affected by the Act no distinction is made of ambassadors, merchants, consuls, artists, professors or travellers, or sex, whether under disability or not, or at such a distance from a collector as to make it difficult or impossible to obtain a license. Every person of Chinese origin, whether naturalized in Hong Kong or America, or any other State with which we are at amity, so long as they are of Chinese origin, 14 years of age—every one without distinction—must take out a license. For the purpose of argument I have treated the license fee as a tax; but it is in fact a license—a license to remain in British Columbia unmolested for a year. When the legislature wanted to create a tax, they knew what words to use for the purpose, for in the sister Act passed on the same day, which was disallowed, they called the impost there enacted a ""tax,"" not a license. However difficult or impossible for any Chinese to find a district collector, if such Chinese is ""found without a license he is liable to a fine of $40."" At every turn he is confronted with an exceptional duty, and an exceptional penalty, and the loss of his goods and chattels, and of personal liberty. 

It is impossible but that such an imposition so enforced, in addition to all the general taxes to which he is subject, should make this country too hot for him to live in; and just in proportion as he is so persecuted out of the country, in that degree does this enactment interfere with trade and commerce and that control over aliens exclusively given to the Dominion. And not only is he thus attacked, but unheard of provisions are introduced. Every employé of Chinese labour, whether English, American, or what not, is made liable to severe and incessant liability of a penal kind, for what? Some act, a default of his own? No; an act or default of a stranger, a man whose language he knows not, and for every infraction of the Act by the Chinese under his employ. The palpable object of such a provision, or set of provisions, is to render the employment of Chinese so distasteful and annoying to the employer that he must cease to employ them. Now, to pass a law providing that employment shall not be given to a special class of men, except it be productive of so much danger, annoyance, and loss to the employer, is just another way of saying that no intercourse shall be had with that class. With penalties and prosecutions always before you, far in excess of any advantage to be derived from that intercourse or trade, what is that but equivalent to saying that such intercourse or trade or labour must cease altogether. What is that but interfering with aliens, trade, and commerce? 

If a man employ a Chinaman who should happen to be delinquent in his tax, and he happens to occupy a cottage or room of his employer, with his master's goods in it, under section 10 they are liable to seizure and sale. In every prosecution under the Act the legal presumption of innocence until conviction is reversed; in every case the onus probandi, though in a Statute highly penal, is shifted from the informant on to the shoulders of the accused, and he a foreigner not knowing one word of the law, or even the language of the accuser. In other words, every Chinese is guilty until proved innocent—a provision which fills one conversant with subjects with alarm; for if such a law can be tolerated as against Chinese, the precedent is set, and in time of any popular outcry can easily be acted on for putting any other foreigners or even special classes among ourselves, as coloured people, or French, Italians, Americans, or Germans, under equally the same law. That certainly is interfering with aliens. 

The proposition that it is a Provincial tax for revenue purposes, supposing it to be so intended under the provisions of the Act, is so manifestly calculated to defeat that object, by diminishing the numbers of the members of the persons to be affected by it, that it is difficult to regard it in that light, or in any other light than an indirect mode of getting rid of persons whom it affects out of the country. The whole Act teems with special provisions which affect not only Chinese, but their employers, with obligations and liabilities as to the conduct of the Chinese in their employ, that no reasonable man would encounter, and run the risk of the penal consequences which the Act hangs over him. 

For instance, by section 19 any pecuniary penalty imposed may be summarily recovered (and applies to employers), and in default of immediate payment the same may be recovered by distress of the goods and chattels of the offender, and in default of sufficient distress by a liability to imprisonment for three calendar months, and the employers would necessarily be white men. 

In fact, the Act so bristles with these arbitrary, exceptional and penal consequences, that it is invidious to single out particular ones for comment. It is enough to add that ""any person,"" no matter whether white or Chinese, imprisoned in respect of any infraction of the provisions of the Act, may be at the will of the executive, subjected even to hard labour. 

The Act is so full of provisions that interfere directly with aliens, with trade, and with commerce, that I have no hesitation in pronouncing all such provisions, and among them those under which the appellant in this case has been convicted, to be ultra vires the local legislature, and consequently illegal and void. 

So far, I have dealt with the Act on its own merits; but if we consider it in juxtaposition to the Dominion Act recently passed restricting the Chinese throughout all Canada, its illegality becomes transparent; for in passing that Act against the Chinese the Dominion has spoken by the highest authority which it possesses—its own Parliament. By the Constitutional Act the subject of aliens, we have seen, is specially reserved to the Dominion, and it is now an axiom, in the interpretation of that Act, that when that authority deals with a subject expressly included in its jurisdiction by the 91st section, it has possession of that subject exclusively, and the Province has to give way. It is a great assumption of power on the part of a Province to pass laws, the effect of which must be practically to expel a particular class of aliens from that Province, to say in effect that it will by its legislation impede or prevent that class from being employed in another Province—say the North-west Territory or Manitoba—where railway works may be languishing for want of that very class of labourers, British Columbia being the only sea-board of Canada on the Pacific through which (in face of the restrictive laws of the United States) that class of labourers can enter and pass through; that is, in fact, legislating on all inter-provincial immigration; in other words, such legislation is ultra vires, and so I pronounce it; and adjudge accordingly, and quash the conviction, with costs. 


"
